{
  "document": {
    "publicationDate": "2022-10-04T09:00:52.123Z"
  },
  "venue": {
    "venueContact": {
      "venueTelephone": "01772\r\n 844700",
      "venueEmail": "court1@moj.\r\ngov.uk"
    }
  },
  "locationDetails": {
    "jurisdiction": "Tribunal\r\n"
  },
  "courtLists": [
    {
      "courtHouse": {
        "courtHouseName": "The\r\n Court House",
        "courtHouseAddress": {
          "line": [
            "Court \r\nStreet"
          ],
          "town": "Court \r\n Town",
          "county": "Court \r\n County",
          "postCode": "SK4\r\n 5LE"
        },
        "courtRoom": [
          {
            "session": [
              {
                "sessionStartTime": "2022-10-05T09:00:52.123Z",
                "sittings": [
                  {
                    "sittingStart": "2022-10-05T11:00:52.123Z",
                    "sittingEnd": "2022-10-06T11:30:52.123Z",
                    "hearing": [
                      {
                        "hearingType": "Remote -\r\n Teams",
                        "case": [
                          {
                            "caseName": "A Vs \r\nB",
                            "caseNumber": "4568\r\n4548",
                            "caseSequenceIndicator": "1\r\n of 2"
                          }
                        ]
                      }
                    ]
                  }
                ]
              }
            ]
          }
        ]
      }
    }
  ]
}
